{"adapter_artifact_id":"ロールアウト-🄰-0001","adapter_id":"codex-rollout","adapter_projection_version":"2.3.1","artifact_kind":"file-slice","attestation_id":"e6a9891878b32cf49c3f2ea6e62edfbd45b48ec9103af17ad0feee36bcfdba6e","blob_digest":"256345a0ca0741c411af06de360048f31d22cc715d44b58a82886e877b457780","capture_time":"2026-09-22T09:59:10Z","compressed_size":126,"envelope_creation_time":"2026-09-22T09:59:11Z","envelope_version":1,"generation":"1a07a112-7000-7000-8000-000000000002","harness":"codex","id_source":"upstream","incoming_checksum":"256345a0ca0741c411af06de360048f31d22cc715d44b58a82886e877b457780","incoming_checksum_algorithm":"sha256","occurrence_id":"cefbdab031ae55ba31b81660bfe4968558fa439b7e393196f8d95824fd0e6533","origin_client_id":"11111111-2222-4333-8444-555555555555","protocol_version":1,"range_end":0,"range_kind":"byte","range_start":0,"request_id":"1a07b202-7000-7000-8000-000000000002","source_time":"2026-09-22T09:58:44Z","storage_profile":"zstd-v1","tenant_id":"0f1e2d3c-4b5a-4978-8a9b-0c1d2e3f4a5b","transport_encoding":"identity","uncompressed_size":126,"uploader_client_id":"11111111-2222-4333-8444-555555555555","upstream_session_id":"対話-セッション-🤖-café-0001"}