{"adapter_artifact_id":"store-projection-synthetic-0001","adapter_id":"pi-store","adapter_projection_version":"1.0.0-rc.2","artifact_kind":"database-projection","attestation_id":"90c24490cb47465adf5734bbce9b07a3c12ccc8f94b3febdddc056386d487cf1","blob_digest":"7dd31bcbc1fa066dd3731eadf541ae24c2c4dce591dc24de40b461b2de30867d","capture_time":"2026-09-22T10:01:10Z","compressed_size":228,"envelope_creation_time":"2026-09-22T10:01:11Z","envelope_version":1,"generation":"1a07a113-7000-7000-8000-000000000003","harness":"pi","id_source":"synthetic","incoming_checksum":"7dd31bcbc1fa066dd3731eadf541ae24c2c4dce591dc24de40b461b2de30867d","incoming_checksum_algorithm":"sha256","occurrence_id":"b6a59463dd2bc59ec7bfbe29898cb1ebd7066fdffe75ed6cd4167b168bbec1dd","origin_client_id":"11111111-2222-4333-8444-555555555555","protocol_version":1,"range_end":2,"range_kind":"event","range_start":0,"request_id":"1a07b203-7000-7000-8000-000000000003","storage_profile":"zstd-v1","tenant_id":"0f1e2d3c-4b5a-4978-8a9b-0c1d2e3f4a5b","transport_encoding":"identity","uncompressed_size":228,"uploader_client_id":"11111111-2222-4333-8444-555555555555","upstream_session_id":"d4811c22-93e4-4f30-8b17-a1c2d3e4f5a6"}