{"adapter_artifact_id":"session-file-4f9c2f1e","adapter_id":"claude-jsonl","adapter_projection_version":"1","artifact_kind":"file-slice","attestation_id":"1711ca60d13cf916919e5a90ab548859e1c5e5cadef8c9948d19318f9d0bfe87","blob_digest":"1954362cfdaf85cb2a0dd5825a303964da1fb31cf96d0f9739db3c4882327175","capture_time":"2026-09-22T10:03:10Z","compressed_size":176,"envelope_creation_time":"2026-09-22T10:03:11Z","envelope_version":1,"generation":"1a07a111-7000-7000-8000-000000000001","harness":"claude-code","id_source":"upstream","incoming_checksum":"1954362cfdaf85cb2a0dd5825a303964da1fb31cf96d0f9739db3c4882327175","incoming_checksum_algorithm":"sha256","occurrence_id":"d4987eccc7f41c78d90416b3ddbd2e7850341b0497cec0565ac074869dfcafe5","origin_client_id":"11111111-2222-4333-8444-555555555555","protocol_version":1,"range_end":0,"range_kind":"byte","range_start":0,"request_id":"1a07b204-7000-7000-8000-000000000004","source_time":"2026-09-11T16:44:02Z","storage_profile":"zstd-v1","tenant_id":"0f1e2d3c-4b5a-4978-8a9b-0c1d2e3f4a5b","trace_id":"conformance-trace-relay-0001","transport_encoding":"identity","uncompressed_size":176,"uploader_client_id":"aaaaaaa1-bbbb-4ccc-9ddd-1e2f3f4f5f6f","upstream_session_id":"4f9c2f1e-8a3d-4b67-9c2f-1e8a3d4b679c"}